{"schema_version":"1.0.0","registry_version":"1.3.0","components":[{"component_id":"webnovel-production-workflow","active_version":"1.15.0","candidate_version":null,"previous_version":"1.14.0","status":"active","proposal_id":null},{"component_id":"context-router","active_version":"1.2.0","candidate_version":null,"previous_version":"1.1.0","status":"active","proposal_id":null},{"component_id":"prompt-registry","active_version":"1.15.0","candidate_version":null,"previous_version":"1.14.0","status":"active","proposal_id":null},{"component_id":"legacy-data-overlay","active_version":"1.1.0","candidate_version":null,"previous_version":"1.0.0","status":"active","proposal_id":null}],"history":[]}
